{
  "$schema": "https://json-schema.org/draft/2020-12/schema",
  "$id": "klode-kit/isolation_receipt.json",
  "title": "Cloud isolation receipt",
  "description": "Deterministic isolation review of the exact argv/cwd/env about to run, plus the optional synthetic probe (02 r4.3). Binds the CLI version, the effective configuration and the argv; any failed check forbids PASS.",
  "type": "object",
  "additionalProperties": false,
  "required": [
    "schema",
    "route",
    "cli_version",
    "effective_config_sha",
    "argv_sha",
    "checks",
    "cloud_isolation"
  ],
  "properties": {
    "schema": {
      "const": "klode-kit.isolation_receipt/1"
    },
    "route": {
      "enum": [
        "claude",
        "codex"
      ]
    },
    "cli_version": {
      "type": "string",
      "pattern": "^[0-9]+\\.[0-9]+\\.[0-9]+"
    },
    "effective_config_sha": {
      "type": "string",
      "pattern": "^[0-9a-f]{64}$"
    },
    "argv_sha": {
      "type": "string",
      "pattern": "^[0-9a-f]{64}$"
    },
    "cloud_settings_sha": {
      "type": [
        "string",
        "null"
      ],
      "pattern": "^[0-9a-f]{64}$"
    },
    "at": {
      "type": "string",
      "pattern": "^\\d{4}-\\d{2}-\\d{2}T\\d{2}:\\d{2}:\\d{2}(\\.\\d+)?(Z|[+-]\\d{2}:\\d{2})$"
    },
    "cwd": {
      "type": "string",
      "pattern": "^/"
    },
    "checks": {
      "type": "array",
      "minItems": 1,
      "items": {
        "type": "object",
        "additionalProperties": false,
        "required": [
          "name",
          "ok"
        ],
        "properties": {
          "name": {
            "type": "string",
            "minLength": 1
          },
          "ok": {
            "type": "boolean"
          },
          "detail": {
            "type": "string"
          }
        }
      }
    },
    "cloud_isolation": {
      "enum": [
        "PASS",
        "FAIL",
        "inconclusive"
      ]
    },
    "probe": {
      "type": "object",
      "additionalProperties": false,
      "required": [
        "model_actual",
        "cost_usd",
        "attempts"
      ],
      "properties": {
        "model_actual": {
          "type": [
            "string",
            "null"
          ]
        },
        "cost_usd": {
          "type": "number",
          "minimum": 0
        },
        "attempts": {
          "type": "array"
        },
        "verdict": {
          "enum": [
            "PASS",
            "FAIL",
            "inconclusive"
          ]
        }
      }
    }
  },
  "allOf": [
    {
      "if": {
        "required": [
          "checks"
        ],
        "properties": {
          "checks": {
            "contains": {
              "required": [
                "ok"
              ],
              "properties": {
                "ok": {
                  "const": false
                }
              }
            }
          }
        }
      },
      "then": {
        "properties": {
          "cloud_isolation": {
            "not": {
              "const": "PASS"
            }
          }
        }
      }
    }
  ]
}
